{
  "proposal_id": "f1111111-1111-4111-8111-111111111111",
  "resource_draft_id": "f7121111-1111-4111-8111-111111111111",
  "title": "链表反转中的三个指针",
  "resource_type": "mixed",
  "difficulty_level": 2,
  "target_knowledge_node_ids": [
    "linked_list_pointer"
  ],
  "summary": "通过图解和代码说明前驱、当前和后继指针。",
  "resource_sections": [
    {
      "resource_section_id": "f7131111-1111-4111-8111-111111111111",
      "heading": "更新顺序",
      "body_markdown": "先保存后继节点，再反转当前节点指针，最后整体前移。",
      "key_points": [
        "先保存后继节点",
        "再修改当前节点的 next",
        "最后移动三个指针"
      ],
      "evidence_ids": [
        "fd111111-1111-4111-8111-111111111111"
      ]
    }
  ],
  "code_examples": [
    {
      "language": "python",
      "code": "def reverse_list(head):\n    prev = None\n    cur = head\n    while cur:\n        nxt = cur.next\n        cur.next = prev\n        prev, cur = cur, nxt\n    return prev",
      "explanation": "nxt 必须在修改 cur.next 之前保存。",
      "evidence_ids": [
        "fd111111-1111-4111-8111-111111111111"
      ]
    }
  ],
  "evidence_ids": [
    "fd111111-1111-4111-8111-111111111111"
  ],
  "confidence": 0.88
}
